{
  "algorithm": {
    "name": "aerost-deterministic-greedy-multicover",
    "selection": "maximum remaining witness-slot gain",
    "tie_breaking": [
      "minimum cycle count",
      "lexicographically smallest scenario id"
    ],
    "version": "0.1.0"
  },
  "deterministic": true,
  "input_summary": {
    "cycles": 773,
    "obligations": 327,
    "required_witness_slots": 333,
    "scenarios": 333
  },
  "mcdc_summary": {
    "missing_witnesses": [],
    "obligations": 6,
    "required_witnesses_per_obligation": 2,
    "witness_counts": {
      "OBL-MCDC-AIR-DEC-8C1AAF3C5949-AIR-COND-14A07CAD6C04": 2,
      "OBL-MCDC-AIR-DEC-8C1AAF3C5949-AIR-COND-63B49803733D": 2,
      "OBL-MCDC-AIR-DEC-A2A44279A13D-AIR-COND-46486C3E7B4D": 2,
      "OBL-MCDC-AIR-DEC-A2A44279A13D-AIR-COND-933AFAC55E2F": 2,
      "OBL-MCDC-AIR-DEC-A2A44279A13D-AIR-COND-B1E7AF6F9325": 2,
      "OBL-MCDC-AIR-DEC-A2A44279A13D-AIR-COND-D765DACDD027": 2
    }
  },
  "output_summary": {
    "covered_obligations": 327,
    "covered_witness_slots": 333,
    "cycle_reduction_percent": 81.630013,
    "scenario_reduction_percent": 82.882883,
    "selected_cycles": 142,
    "selected_scenarios": 57
  },
  "passed": true,
  "profile_version": "ASCP-0.2",
  "program_id": "AIR-PROG-E1DC8CAED523",
  "reduction_run_id": "REDUCE-RUN-0DF9AD8FFDF5",
  "schema_version": "AEROST-SUITE-REDUCTION-REPORT-0.1",
  "selection_trace": [
    {
      "covered_witness_slots_after_selection": 103,
      "cycle_count": 4,
      "gain": 103,
      "newly_covered_obligations": [
        "OBL-CASE-AIR-CASEARM-0C65CCF090C2",
        "OBL-CASE-AIR-CASEARM-17316AC42461",
        "OBL-CASE-AIR-CASEARM-17348B966D74",
        "OBL-CASE-AIR-CASEARM-ACE74C54455A",
        "OBL-CASE-AIR-CASEARM-CE063C63AB93",
        "OBL-CASE-AIR-CASEARM-F44F0EA89CF2",
        "OBL-CASE-AIR-CASEARM-F6051AB75266",
        "OBL-COND-AIR-COND-1342E8B61A2A-FALSE",
        "OBL-COND-AIR-COND-144BC0B8AB3F-FALSE",
        "OBL-COND-AIR-COND-14A07CAD6C04-TRUE",
        "OBL-COND-AIR-COND-21E225A519E1-FALSE",
        "OBL-COND-AIR-COND-21E225A519E1-TRUE",
        "OBL-COND-AIR-COND-2F99F25465C8-FALSE",
        "OBL-COND-AIR-COND-3AFC47255EBC-FALSE",
        "OBL-COND-AIR-COND-40809FD7BD8C-TRUE",
        "OBL-COND-AIR-COND-46486C3E7B4D-TRUE",
        "OBL-COND-AIR-COND-48A098CCEFFC-TRUE",
        "OBL-COND-AIR-COND-4C5A67F31175-TRUE",
        "OBL-COND-AIR-COND-50A7117E5BB5-FALSE",
        "OBL-COND-AIR-COND-592BFC643C74-FALSE",
        "OBL-COND-AIR-COND-5A81CE40A399-TRUE",
        "OBL-COND-AIR-COND-63B49803733D-TRUE",
        "OBL-COND-AIR-COND-6FC64088584E-TRUE",
        "OBL-COND-AIR-COND-741536FE89BA-TRUE",
        "OBL-COND-AIR-COND-75BCDA7E7E54-FALSE",
        "OBL-COND-AIR-COND-79C6E960DBD5-TRUE",
        "OBL-COND-AIR-COND-8A52A49CD6CF-TRUE",
        "OBL-COND-AIR-COND-8B529D83F7A1-FALSE",
        "OBL-COND-AIR-COND-933AFAC55E2F-TRUE",
        "OBL-COND-AIR-COND-A3A3B37A7589-FALSE",
        "OBL-COND-AIR-COND-A47FB4F62113-TRUE",
        "OBL-COND-AIR-COND-B1E7AF6F9325-FALSE",
        "OBL-COND-AIR-COND-B3AB2C8B1E72-FALSE",
        "OBL-COND-AIR-COND-BB61825D52A7-FALSE",
        "OBL-COND-AIR-COND-C9A77B0A56A4-FALSE",
        "OBL-COND-AIR-COND-D3BFA46CC2AB-TRUE",
        "OBL-COND-AIR-COND-D765DACDD027-TRUE",
        "OBL-COND-AIR-COND-E13100E69473-TRUE",
        "OBL-COND-AIR-COND-EE98B9F464DC-TRUE",
        "OBL-COND-AIR-COND-EFE56C86C850-TRUE",
        "OBL-COND-AIR-COND-F4060203942C-FALSE",
        "OBL-COND-AIR-COND-FAFFD9146AC0-TRUE",
        "OBL-COND-AIR-COND-FC4C836BC163-FALSE",
        "OBL-DEC-AIR-DEC-0AE9E0F52239-FALSE",
        "OBL-DEC-AIR-DEC-0AE9E0F52239-TRUE",
        "OBL-DEC-AIR-DEC-0CEBB87E5827-TRUE",
        "OBL-DEC-AIR-DEC-2A128CF8D3BB-FALSE",
        "OBL-DEC-AIR-DEC-865460DD81C4-TRUE",
        "OBL-DEC-AIR-DEC-8C1AAF3C5949-TRUE",
        "OBL-DEC-AIR-DEC-93A18B494A46-FALSE",
        "OBL-DEC-AIR-DEC-A2A44279A13D-TRUE",
        "OBL-DEC-AIR-DEC-B12405B9C306-FALSE",
        "OBL-DEC-AIR-DEC-BB5E24035C0C-FALSE",
        "OBL-DEC-AIR-DEC-DF6B93D358C8-FALSE",
        "OBL-DEC-AIR-DEC-EB272A2D98BB-TRUE",
        "OBL-DEC-AIR-DEC-F26BBA9634D5-FALSE",
        "OBL-DEC-AIR-DEC-FD89DC1C5ADD-TRUE",
        "OBL-RECOVERY-PWR-RECOVERY-CRITICAL",
        "OBL-REQ-PWR-HLR-001",
        "OBL-REQ-PWR-HLR-002",
        "OBL-REQ-PWR-HLR-005",
        "OBL-REQ-PWR-HLR-008",
        "OBL-REQ-PWR-HLR-009",
        "OBL-REQ-PWR-HLR-010",
        "OBL-REQ-PWR-HLR-011",
        "OBL-REQ-PWR-HLR-012",
        "OBL-REQ-PWR-HLR-013",
        "OBL-REQ-PWR-HLR-014",
        "OBL-REQ-PWR-HLR-015",
        "OBL-RESET-PWR-RESET-RECOVERY-PENDING",
        "OBL-STMT-AIR-STMT-029FD17D66EA",
        "OBL-STMT-AIR-STMT-0603DAD4493D",
        "OBL-STMT-AIR-STMT-22EA36CE7782",
        "OBL-STMT-AIR-STMT-33396C3EF0F2",
        "OBL-STMT-AIR-STMT-39F8E8639950",
        "OBL-STMT-AIR-STMT-3A8D9B1590D7",
        "OBL-STMT-AIR-STMT-3C3A46196002",
        "OBL-STMT-AIR-STMT-4852C2496F28",
        "OBL-STMT-AIR-STMT-49A6537C2F51",
        "OBL-STMT-AIR-STMT-53159465EEC7",
        "OBL-STMT-AIR-STMT-55E6AE17D2D3",
        "OBL-STMT-AIR-STMT-63250DD6E3B2",
        "OBL-STMT-AIR-STMT-6F7682246674",
        "OBL-STMT-AIR-STMT-73145824122F",
        "OBL-STMT-AIR-STMT-77E05FA86735",
        "OBL-STMT-AIR-STMT-80CDAC22F297",
        "OBL-STMT-AIR-STMT-84CF0E9E7908",
        "OBL-STMT-AIR-STMT-89CEA56742DD",
        "OBL-STMT-AIR-STMT-9F20ED2E03E8",
        "OBL-STMT-AIR-STMT-A218C155F879",
        "OBL-STMT-AIR-STMT-A2C5E796C1C9",
        "OBL-STMT-AIR-STMT-A7916E79B9DE",
        "OBL-STMT-AIR-STMT-B196FBA75D16",
        "OBL-STMT-AIR-STMT-BC40D66589B3",
        "OBL-STMT-AIR-STMT-BCA1050F6F69",
        "OBL-STMT-AIR-STMT-BCE73FB5DDAD",
        "OBL-STMT-AIR-STMT-D0CA7CC162F7",
        "OBL-STMT-AIR-STMT-D79FB6C6FBA5",
        "OBL-STMT-AIR-STMT-DD5316804F59",
        "OBL-STMT-AIR-STMT-DF1C16A6A5C0",
        "OBL-STMT-AIR-STMT-E87BE3D9122E",
        "OBL-STMT-AIR-STMT-EAED9383D904",
        "OBL-STMT-AIR-STMT-FF1C6D4C2F66"
      ],
      "scenario_id": "SYN-63DF634F15D4",
      "selection_index": 1
    },
    {
      "covered_witness_slots_after_selection": 139,
      "cycle_count": 3,
      "gain": 36,
      "newly_covered_obligations": [
        "OBL-CASE-AIR-CASEARM-A638FEAAFDF4",
        "OBL-CASE-AIR-CASEARM-F494399BCEFC",
        "OBL-COND-AIR-COND-0E4BEDA3E54F-FALSE",
        "OBL-COND-AIR-COND-14A07CAD6C04-FALSE",
        "OBL-COND-AIR-COND-15F32731B053-TRUE",
        "OBL-COND-AIR-COND-3BDC2757859D-TRUE",
        "OBL-COND-AIR-COND-69E1E0C7E3C9-FALSE",
        "OBL-COND-AIR-COND-817FF4A2CA56-TRUE",
        "OBL-COND-AIR-COND-83F3B5EB4933-TRUE",
        "OBL-COND-AIR-COND-8BBE51FE9300-FALSE",
        "OBL-COND-AIR-COND-9C40B9684FA7-FALSE",
        "OBL-COND-AIR-COND-A9AACEB02838-TRUE",
        "OBL-COND-AIR-COND-BA77AC6CEF43-FALSE",
        "OBL-COND-AIR-COND-C14F85047E54-FALSE",
        "OBL-COND-AIR-COND-CC86694FC691-FALSE",
        "OBL-COND-AIR-COND-D2D9B19380C7-FALSE",
        "OBL-COND-AIR-COND-DC2862148359-FALSE",
        "OBL-COND-AIR-COND-E627EE416F1A-TRUE",
        "OBL-COND-AIR-COND-E9CE4594367D-TRUE",
        "OBL-DEC-AIR-DEC-0D2B6D2854BB-TRUE",
        "OBL-DEC-AIR-DEC-2BF8D2D61B9A-FALSE",
        "OBL-DEC-AIR-DEC-47BA8AADEC39-FALSE",
        "OBL-DEC-AIR-DEC-8C1AAF3C5949-FALSE",
        "OBL-DEC-AIR-DEC-A4965EA0089C-FALSE",
        "OBL-DEC-AIR-DEC-CA16FEDC06F6-TRUE",
        "OBL-DEC-AIR-DEC-E154C6B87FFB-FALSE",
        "OBL-RECOVERY-PWR-RECOVERY-DEGRADED",
        "OBL-REQ-PWR-HLR-004",
        "OBL-REQ-PWR-HLR-006",
        "OBL-REQ-PWR-HLR-007",
        "OBL-STMT-AIR-STMT-0992AE421B6B",
        "OBL-STMT-AIR-STMT-363BB5F7BABB",
        "OBL-STMT-AIR-STMT-B5D2E3D5D648",
        "OBL-STMT-AIR-STMT-C5DFEB3D124D",
        "OBL-STMT-AIR-STMT-E2A1F642F5D8",
        "OBL-STMT-AIR-STMT-E79B42D9F9AB"
      ],
      "scenario_id": "SYN-75238302328D",
      "selection_index": 2
    },
    {
      "covered_witness_slots_after_selection": 164,
      "cycle_count": 2,
      "gain": 25,
      "newly_covered_obligations": [
        "OBL-CASE-AIR-CASEARM-46F1F30D749B",
        "OBL-CASE-AIR-CASEARM-A6408568CED8",
        "OBL-COND-AIR-COND-14721A8DD0AF-TRUE",
        "OBL-COND-AIR-COND-2C0CE59B2B64-TRUE",
        "OBL-COND-AIR-COND-2D0D9A9B15DB-TRUE",
        "OBL-COND-AIR-COND-418210273076-TRUE",
        "OBL-COND-AIR-COND-7475F8D3D8FD-TRUE",
        "OBL-COND-AIR-COND-75BCDA7E7E54-TRUE",
        "OBL-COND-AIR-COND-824107AE33E7-TRUE",
        "OBL-COND-AIR-COND-933AFAC55E2F-FALSE",
        "OBL-COND-AIR-COND-97DBB6731217-TRUE",
        "OBL-COND-AIR-COND-CC11C4447B85-TRUE",
        "OBL-COND-AIR-COND-D765DACDD027-FALSE",
        "OBL-COND-AIR-COND-E3220C881F3F-TRUE",
        "OBL-COND-AIR-COND-FA89E0B9D778-FALSE",
        "OBL-DEC-AIR-DEC-3769441570C5-TRUE",
        "OBL-DEC-AIR-DEC-A2A44279A13D-FALSE",
        "OBL-DEC-AIR-DEC-BBC0832C9670-TRUE",
        "OBL-RESET-PWR-RESET-LOCKOUT",
        "OBL-STMT-AIR-STMT-005040901B77",
        "OBL-STMT-AIR-STMT-6D50A2C7A880",
        "OBL-STMT-AIR-STMT-8FBA964424C9",
        "OBL-STMT-AIR-STMT-A9758B660C0C",
        "OBL-STMT-AIR-STMT-C5D5741BE9B0",
        "OBL-STMT-AIR-STMT-E7022F914D29"
      ],
      "scenario_id": "SYN-1321A07D7DFC",
      "selection_index": 3
    },
    {
      "covered_witness_slots_after_selection": 185,
      "cycle_count": 3,
      "gain": 21,
      "newly_covered_obligations": [
        "OBL-CASE-AIR-CASEARM-A693C2BFC2F0",
        "OBL-CASE-AIR-CASEARM-D9DD6A18D30F",
        "OBL-COND-AIR-COND-00908D0AC570-FALSE",
        "OBL-COND-AIR-COND-36B0D097C415-FALSE",
        "OBL-COND-AIR-COND-66F919A4468C-FALSE",
        "OBL-COND-AIR-COND-679C2BD98047-FALSE",
        "OBL-COND-AIR-COND-7E3F9A986A6A-FALSE",
        "OBL-COND-AIR-COND-A60A2BD8F2FD-TRUE",
        "OBL-COND-AIR-COND-B75BA1081948-TRUE",
        "OBL-COND-AIR-COND-BABD48A64B79-FALSE",
        "OBL-COND-AIR-COND-BC1A60139F1A-FALSE",
        "OBL-COND-AIR-COND-CC86694FC691-TRUE",